{"artifacts":[{"base64":"PD94bWwgdmVyc2lvbj0iMS4wIiBlbmNvZGluZz0iVVRGLTgiPz4KPHJlc3VsdHMgdmVyc2lvbj0iMiI+CiAgICA8Y3BwY2hlY2sgdmVyc2lvbj0iMi43Ii8+CiAgICA8ZXJyb3JzPgogICAgPC9lcnJvcnM+CjwvcmVzdWx0cz4K","bytes":129,"format":"cppcheck-xml","id":"cppcheck-0","retained_sha256":"84677b7b03a30761db88f0f40d7c12153cb09afb91ff158d7972017df6607b79","sha256":"84677b7b03a30761db88f0f40d7c12153cb09afb91ff158d7972017df6607b79","translation_unit":"capability.cpp","truncated":false}],"assurance_eligibility":"not_eligible","capability":{"checks":["warning","style","performance","portability","information","missingInclude"],"effective_config":{"enable":["warning","style","performance","portability","information","missingInclude"],"error_exitcode":2,"id":"cppcheck-cpp17-local-v1","kind":"quality_cppcheck_configuration","language":"c++","max_configs":12,"platform":"unix64","schema_version":1,"standard":"c++17","status":"proposed_local_complementary","xml_version":2},"state":"available"},"configuration":{"adapter":"cppcheck","effective":{"enable":["warning","style","performance","portability","information","missingInclude"],"error_exitcode":2,"id":"cppcheck-cpp17-local-v1","kind":"quality_cppcheck_configuration","language":"c++","max_configs":12,"platform":"unix64","schema_version":1,"standard":"c++17","status":"proposed_local_complementary","xml_version":2},"path":"/home/jefferson/s-core_sw_fabric/profiles/cppcheck-cpp17-local-v1.yaml","sha256":"62ac2e2c9984b7ef1cefb24db6ede6c4ef495630ebd864cc982d108cf609ebe1"},"digest":"da4cad8a9972b6123dd27a17bceb3a76af35049796a571efd328b3fb34206771","engineering_readiness":"not_evaluated","gaps":["ADAPTER_UNIMPLEMENTED:codeql-misra","CAPABILITY_NOT_SELECTED:asan","CAPABILITY_NOT_SELECTED:clang-tidy","CAPABILITY_NOT_SELECTED:ubsan","CODEQL_ELIGIBILITY_UNKNOWN","MANUAL_REVIEW_PENDING","PRODUCTION_AUTHORITY_UNAVAILABLE","RULE_MAPPING_UNKNOWN","TOOL_CONFIDENCE_UNKNOWN"],"kind":"quality_cppcheck_capability_inventory","origin":"local_unprotected_execution","outcome":"completed","phases":[{"argv":["/usr/bin/cppcheck","--version"],"elapsed_seconds":0.002482,"error":null,"exit_code":0,"name":"version","stderr":{"base64":"","bytes":0,"format":"text","retained_sha256":"e3b0c44298fc1c149afbf4c8996fb92427ae41e4649b934ca495991b7852b855","sha256":"e3b0c44298fc1c149afbf4c8996fb92427ae41e4649b934ca495991b7852b855","truncated":false},"stdout":{"base64":"Q3BwY2hlY2sgMi43Cg==","bytes":13,"format":"text","retained_sha256":"0e0f792d9e8d9b991231efe1d8a7c9f41505026f218e20c8767432c58905be7e","sha256":"0e0f792d9e8d9b991231efe1d8a7c9f41505026f218e20c8767432c58905be7e","truncated":false},"timed_out":false},{"argv":["/usr/bin/cppcheck","--std=c++17","--language=c++","--enable=warning,style,performance,portability,information,missingInclude","--platform=unix64","--max-configs=12","--xml","--xml-version=2","--error-exitcode=2","/tmp/score-quality-heiyi8yw/source/capability.cpp"],"elapsed_seconds":0.006476,"error":null,"exit_code":0,"name":"analyze:capability.cpp","stderr":{"base64":"PD94bWwgdmVyc2lvbj0iMS4wIiBlbmNvZGluZz0iVVRGLTgiPz4KPHJlc3VsdHMgdmVyc2lvbj0iMiI+CiAgICA8Y3BwY2hlY2sgdmVyc2lvbj0iMi43Ii8+CiAgICA8ZXJyb3JzPgogICAgPC9lcnJvcnM+CjwvcmVzdWx0cz4K","bytes":129,"format":"text","retained_sha256":"84677b7b03a30761db88f0f40d7c12153cb09afb91ff158d7972017df6607b79","sha256":"84677b7b03a30761db88f0f40d7c12153cb09afb91ff158d7972017df6607b79","truncated":false},"stdout":{"base64":"Q2hlY2tpbmcgL3RtcC9zY29yZS1xdWFsaXR5LWhlaXlpOHl3L3NvdXJjZS9jYXBhYmlsaXR5LmNwcCAuLi4K","bytes":63,"format":"text","retained_sha256":"0c34f7448d63ab3d5e484201162e1b8c95df7ffd389d2f8f279096942282a39c","sha256":"0c34f7448d63ab3d5e484201162e1b8c95df7ffd389d2f8f279096942282a39c","truncated":false},"timed_out":false}],"profile":{"analyzers":[{"id":"clang-tidy","role":"complementary","state":"candidate"},{"id":"codeql-misra","role":"primary","state":"unimplemented"},{"id":"cppcheck","role":"complementary","state":"candidate"}],"decision_policy_ref":null,"guideline_edition":"MISRA C++:2023","id":"s-core-quality-v1","kind":"quality_profile","language":"c++17","mapping_state":"unknown","native_sources":[{"commit":"e2373d822fc2f6e9a3f8a0538904f3faa39309ea","id":"cpp_guidelines","license":"Apache-2.0","native_status":"doc__cpp_coding_guidelines: valid/version 1","notice":"Preserve upstream copyright and NOTICE; no MISRA rule text included","path":"docs/contribute/development/cpp/coding_guidelines.rst","repository":"https://github.com/eclipse-score/score","sha256":"472572e9adf89fae175193f82bbb8aff6dc55bf1aa29b65357cb22d4e6b36333"},{"commit":"e2373d822fc2f6e9a3f8a0538904f3faa39309ea","id":"cpp_analysis","license":"Apache-2.0","native_status":"doc__cpp_code_analysis: valid/version 1","notice":"Preserve upstream copyright and NOTICE; no MISRA rule text included","path":"docs/contribute/development/cpp/code_analysis.rst","repository":"https://github.com/eclipse-score/score","sha256":"b959cdaea697ad8b46b7e179fedeb5d57fc0017544393666d1bdcf79714fd367"},{"commit":"e2373d822fc2f6e9a3f8a0538904f3faa39309ea","id":"misra_mapping","license":"Apache-2.0","native_status":"doc__cpp_misra2023_rule_mapping: draft/version 1; CSV absent","notice":"Preserve upstream copyright and NOTICE; no MISRA rule text included","path":"docs/contribute/development/cpp/misra_2023_rule_mapping.rst","repository":"https://github.com/eclipse-score/score","sha256":"09f6d917db2001c4dd0bec60913089ed8f4533326320b3cd4cbc66e1bdf09600"},{"commit":"9bcfe8296038569a0ff7627fb8ce7a189018a7b3","id":"clang_tidy","license":"Apache-2.0","native_status":"source policy; tailoring pending","notice":"Preserve upstream copyright and NOTICE; no MISRA rule text included","path":"clang_tidy/.clang-tidy","repository":"https://github.com/eclipse-score/score_cpp_policies","sha256":"fe06da767c62270a410d08bd07cdfc13cf2e1c01c0cd31fb15ac37c515f19901"},{"commit":"9bcfe8296038569a0ff7627fb8ce7a189018a7b3","id":"sanitizer_features","license":"Apache-2.0","native_status":"native source policy; local candidate execution; owner tailoring pending","notice":"Original upstream license/NOTICE/copyright preserved in profiles/native-quality","path":"sanitizers/features/BUILD.bazel","repository":"https://github.com/eclipse-score/score_cpp_policies","sha256":"3b3ec4f0ef6ac8c421e1961e60a9d19e60827b3c061361c04e1e6d45b9c4f10c"},{"commit":"9bcfe8296038569a0ff7627fb8ce7a189018a7b3","id":"asan_runtime","license":"Apache-2.0","native_status":"native source policy; local candidate execution; owner tailoring pending","notice":"Original upstream license/NOTICE/copyright preserved in profiles/native-quality","path":"sanitizers/templates/asan.env.template","repository":"https://github.com/eclipse-score/score_cpp_policies","sha256":"9e65b0d94fed741c18df299b0e4bbedbbd39f5f384b94d39721ebfcb239ff5ab"},{"commit":"9bcfe8296038569a0ff7627fb8ce7a189018a7b3","id":"asan_suppressions","license":"Apache-2.0","native_status":"native source policy; local candidate execution; owner tailoring pending","notice":"Original upstream license/NOTICE/copyright preserved in profiles/native-quality","path":"sanitizers/suppressions/asan.supp","repository":"https://github.com/eclipse-score/score_cpp_policies","sha256":"27c9e9ea1f925be8a0021ec78343e7fc057979d2f4f0c9da69e455ac1165c258"},{"commit":"9bcfe8296038569a0ff7627fb8ce7a189018a7b3","id":"ubsan_runtime","license":"Apache-2.0","native_status":"native source policy; local candidate execution; owner tailoring pending","notice":"Original upstream license/NOTICE/copyright preserved in profiles/native-quality","path":"sanitizers/templates/ubsan.env.template","repository":"https://github.com/eclipse-score/score_cpp_policies","sha256":"2f7f6ed76d89be308e0f9f9c3ecc3ea1e0eee8b003cc2fa2f5d7ae47c0a5c170"},{"commit":"9bcfe8296038569a0ff7627fb8ce7a189018a7b3","id":"ubsan_suppressions","license":"Apache-2.0","native_status":"native source policy; local candidate execution; owner tailoring pending","notice":"Original upstream license/NOTICE/copyright preserved in profiles/native-quality","path":"sanitizers/suppressions/ubsan.supp","repository":"https://github.com/eclipse-score/score_cpp_policies","sha256":"771127140a9a674ae93d0f04d06f744841c249597c0e4d976d41bd53459fa694"}],"required_obligations":["RULE_MAPPING_UNKNOWN","MANUAL_REVIEW_PENDING","CODEQL_ELIGIBILITY_UNKNOWN","PRODUCTION_AUTHORITY_UNAVAILABLE","TOOL_CONFIDENCE_UNKNOWN"],"sanitizers":[{"id":"asan","state":"candidate"},{"id":"ubsan","state":"candidate"}],"schema_version":1,"status":"proposed_owner_review_pending"},"schema_version":1,"toolchain":{"dependencies":[{"path":"/usr/lib/x86_64-linux-gnu/cppcheck/cfg/std.cfg","sha256":"d734139be930c6c1fd0cabf8be23d7e4680bead20540deca6116ef66b062cffa"},{"path":"/usr/share/doc/cppcheck/copyright","sha256":"7e9e15f45513f9d487a4455cddafc68ed980c10edf885c46e9840347d3e225db"}],"id":"cppcheck27-local-v1","kind":"quality_cppcheck_toolchain_profile","library_dirs":[],"schema_version":1,"status":"candidate_local_not_selected","tool":{"path":"/usr/bin/cppcheck","sha256":"d2268c85b26850db5f36f7a3a7a2ae0106377810f4f93988bf4ab636481b4d89","version":"Cppcheck 2.7"}}}
